{
  "schema_version": 3,
  "contract_version": "memory_v3_eval_fixture_v1",
  "catalog_id": "task1_core_scenarios",
  "scenarios": [
    {
      "id": "explicit_name_grounded_v3",
      "title": "Explicit preferred name is grounded in user evidence",
      "protection": "review_candidate",
      "priority": "P0",
      "tags": ["formation", "identity", "grounding"],
      "source": "synthetic",
      "timezone": "Asia/Kolkata",
      "language_review": {"status": "pending", "reviewer_id": null, "reviewed_at": null, "notes": "Needs native Hinglish review before protection."},
      "sessions": [
        {"session_id": "session_name_intro", "turns": [
          {"turn_id": "turn_name_user", "role": "user", "text": "Mera naam Aditi hai, mujhe Aditi hi bulana.", "status": "final", "language": "hi-IN", "script": "latin", "created_at_ms": 1784000000000, "stt_confidence": 0.99, "stt_provider": "synthetic", "stt_model": "fixture"},
          {"turn_id": "turn_name_assistant", "role": "assistant", "text": "Aditi, aapse milkar achha laga.", "status": "final", "language": "hi-IN", "script": "latin", "created_at_ms": 1784000001000, "stt_confidence": null, "stt_provider": null, "stt_model": null}
        ]}
      ],
      "formation_expect": {
        "expected_observations": [
          {"expectation_id": "obs_name_aditi", "after_turn_id": "turn_name_user", "kind": "profile", "predicate": "preferred_name", "object_contains": ["Aditi"], "evidence_turn_ids": ["turn_name_user"], "source_role": "user", "temporal_status": "current", "operation": "ADD", "admission": "auto_admit"}
        ],
        "forbidden_predicates": [],
        "expect_noop": false
      },
      "consolidation_expect": {
        "current": [{"kind": "claim", "predicate": "preferred_name", "statement_contains": ["Aditi"], "supporting_turn_ids": ["turn_name_user"]}],
        "historical": [], "episodes": [], "threads": [], "reflections": [], "forbidden": []
      },
      "queries": [
        {
          "query_id": "query_name_recall", "after_session_id": "session_name_intro", "text": "Tum mujhe kis naam se bulaate ho?", "created_at_ms": 1784000100000, "language": "hi-IN", "script": "latin", "response_evaluation": true,
          "expect": {"memory_needed": true, "query_type": "exact_state", "temporal_scope": "current", "must_include_predicates": ["preferred_name"], "must_not_include_predicates": [], "allowed_use_modes": ["EXPLICIT_RECALL"], "max_selected": 1},
          "oracle_brief": {"memory_needed": true, "items": [{"kind": "claim", "predicate": "preferred_name", "statement": "The user's preferred name is Aditi.", "temporal_status": "current", "confidence": 0.99, "source_turn_ids": ["turn_name_user"], "use_mode": "EXPLICIT_RECALL", "warnings": []}], "response_move": "direct_answer", "question_recommended": false, "instruction": "Answer with Aditi briefly and do not announce storage."},
          "response_rubric": {"must_do": ["Use the name Aditi accurately."], "must_not_do": ["Do not claim to have saved or stored the name.", "Do not add an unnecessary question."], "rating_dimensions": ["memory_faithfulness", "memory_use", "naturalness", "question_use", "language_naturalness"]}
        }
      ],
      "hard_gates": ["provenance", "grounding"]
    },
    {
      "id": "assistant_name_contamination_v3",
      "title": "Assistant wording cannot create a user identity",
      "protection": "review_candidate",
      "priority": "P0",
      "tags": ["formation", "assistant_contamination", "identity"],
      "source": "synthetic",
      "timezone": "Asia/Kolkata",
      "language_review": {"status": "pending", "reviewer_id": null, "reviewed_at": null, "notes": "Needs native Hinglish review before protection."},
      "sessions": [
        {"session_id": "session_assistant_name", "turns": [
          {"turn_id": "turn_assistant_name_user", "role": "user", "text": "Aaj bas normal sa din tha.", "status": "final", "language": "hi-IN", "script": "latin", "created_at_ms": 1784000200000, "stt_confidence": 0.96, "stt_provider": "synthetic", "stt_model": "fixture"},
          {"turn_id": "turn_assistant_name_claim", "role": "assistant", "text": "Theek hai Rahul, kabhi kabhi normal din bhi achhe hote hain.", "status": "final", "language": "hi-IN", "script": "latin", "created_at_ms": 1784000201000, "stt_confidence": null, "stt_provider": null, "stt_model": null}
        ]}
      ],
      "formation_expect": {"expected_observations": [], "forbidden_predicates": ["preferred_name"], "expect_noop": true},
      "consolidation_expect": {"current": [], "historical": [], "episodes": [], "threads": [], "reflections": [], "forbidden": [{"kind": "claim", "predicate": "preferred_name", "statement_contains": ["Rahul"], "supporting_turn_ids": ["turn_assistant_name_claim"]}]},
      "queries": [
        {
          "query_id": "query_contaminated_name", "after_session_id": "session_assistant_name", "text": "Mera naam kya hai?", "created_at_ms": 1784000300000, "language": "hi-IN", "script": "latin", "response_evaluation": true,
          "expect": {"memory_needed": false, "query_type": "exact_state", "temporal_scope": "current", "must_include_predicates": [], "must_not_include_predicates": ["preferred_name"], "allowed_use_modes": [], "max_selected": 0},
          "oracle_brief": {"memory_needed": false, "items": [], "response_move": "clarify", "question_recommended": false, "instruction": "Say plainly that the name was not provided; never answer Rahul."},
          "response_rubric": {"must_do": ["Admit that the user's name is not known."], "must_not_do": ["Do not call the user Rahul.", "Do not treat assistant text as evidence."], "rating_dimensions": ["memory_faithfulness", "safety", "helpfulness", "language_naturalness"]}
        }
      ],
      "hard_gates": ["provenance", "grounding"]
    },
    {
      "id": "quoted_relationship_noop_v3",
      "title": "Quoted relationship statement is not a user relationship",
      "protection": "review_candidate",
      "priority": "P0",
      "tags": ["formation", "quoted", "relationship"],
      "source": "synthetic",
      "timezone": "Asia/Kolkata",
      "language_review": {"status": "pending", "reviewer_id": null, "reviewed_at": null, "notes": "Needs native Hinglish review before protection."},
      "sessions": [
        {"session_id": "session_quoted_relation", "turns": [
          {"turn_id": "turn_quote_user", "role": "user", "text": "Rohan bol raha tha, 'meri behen Neha doctor hai'; main sirf uski baat repeat kar raha hoon.", "status": "final", "language": "hi-IN", "script": "latin", "created_at_ms": 1784000400000, "stt_confidence": 0.98, "stt_provider": "synthetic", "stt_model": "fixture"},
          {"turn_id": "turn_quote_assistant", "role": "assistant", "text": "Samjha, yeh Rohan ki baat thi.", "status": "final", "language": "hi-IN", "script": "latin", "created_at_ms": 1784000401000, "stt_confidence": null, "stt_provider": null, "stt_model": null}
        ]}
      ],
      "formation_expect": {"expected_observations": [], "forbidden_predicates": ["has_relationship", "works_at"], "expect_noop": true},
      "consolidation_expect": {"current": [], "historical": [], "episodes": [], "threads": [], "reflections": [], "forbidden": [{"kind": "claim", "predicate": "has_relationship", "statement_contains": ["Neha", "sister"], "supporting_turn_ids": ["turn_quote_user"]}]},
      "queries": [
        {
          "query_id": "query_quoted_sister", "after_session_id": "session_quoted_relation", "text": "Kya meri behen ka naam tumhe pata hai?", "created_at_ms": 1784000500000, "language": "hi-IN", "script": "latin", "response_evaluation": false,
          "expect": {"memory_needed": false, "query_type": "exact_state", "temporal_scope": "current", "must_include_predicates": [], "must_not_include_predicates": ["has_relationship"], "allowed_use_modes": [], "max_selected": 0},
          "oracle_brief": {"memory_needed": false, "items": [], "response_move": "direct_answer", "question_recommended": false, "instruction": "State that the user's sister's name was not provided."},
          "response_rubric": {"must_do": [], "must_not_do": ["Do not say Neha is the user's sister."], "rating_dimensions": []}
        }
      ],
      "hard_gates": ["provenance", "grounding"]
    },
    {
      "id": "hypothetical_goal_noop_v3",
      "title": "Hypothetical goal is not admitted as a real goal",
      "protection": "review_candidate",
      "priority": "P1",
      "tags": ["formation", "hypothetical", "goal"],
      "source": "synthetic",
      "timezone": "Asia/Kolkata",
      "language_review": {"status": "pending", "reviewer_id": null, "reviewed_at": null, "notes": "Needs native Hinglish review before protection."},
      "sessions": [
        {"session_id": "session_hypothetical_goal", "turns": [
          {"turn_id": "turn_hypothetical_goal", "role": "user", "text": "Agar kabhi time mila toh shayad guitar seekhunga, abhi koi plan nahi hai.", "status": "final", "language": "hi-IN", "script": "latin", "created_at_ms": 1784000600000, "stt_confidence": 0.97, "stt_provider": "synthetic", "stt_model": "fixture"},
          {"turn_id": "turn_hypothetical_assistant", "role": "assistant", "text": "Haan, abhi woh sirf ek possibility hai.", "status": "final", "language": "hi-IN", "script": "latin", "created_at_ms": 1784000601000, "stt_confidence": null, "stt_provider": null, "stt_model": null}
        ]}
      ],
      "formation_expect": {"expected_observations": [], "forbidden_predicates": ["pursues_goal"], "expect_noop": true},
      "consolidation_expect": {"current": [], "historical": [], "episodes": [], "threads": [], "reflections": [], "forbidden": [{"kind": "claim", "predicate": "pursues_goal", "statement_contains": ["guitar"], "supporting_turn_ids": ["turn_hypothetical_goal"]}]},
      "queries": [
        {